{
  "id": "sphinx_statue",
  "name": "Sphinx Statue",
  "description": "A statue of a sphinx from ancient times.",
  "type": "material",
  "rarity": "legendary",
  "stackable": true,
  "maxStack": 999,
  "value": 1200,
  "nameKey": "item.sphinx_statue.name",
  "descriptionKey": "item.sphinx_statue.description"
}
