{
  "id": "rabbit_pelt",
  "name": "Rabbit Pelt",
  "description": "A soft pelt from a rabbit caught in a trap.",
  "type": "material",
  "rarity": "common",
  "stackable": true,
  "maxStack": 999,
  "value": 5,
  "nameKey": "item.rabbit_pelt.name",
  "descriptionKey": "item.rabbit_pelt.description"
}
