{
  "id": "roasted_meat",
  "name": "Roasted Meat",
  "description": "A hearty meal that restores health.",
  "type": "consumable",
  "rarity": "common",
  "stackable": true,
  "maxStack": 99,
  "value": 20,
  "consumableEffect": {
    "type": "heal",
    "amount": 75
  },
  "nameKey": "item.roasted_meat.name",
  "descriptionKey": "item.roasted_meat.description"
}
