{
  "id": "fertilizer",
  "name": "Fertilizer",
  "description": "Enriched fertilizer for improving crop yields.",
  "type": "material",
  "rarity": "common",
  "stackable": true,
  "maxStack": 999,
  "value": 5,
  "nameKey": "item.fertilizer.name",
  "descriptionKey": "item.fertilizer.description"
}
