{
  "id": "stolen_scroll_basic",
  "name": "Stolen Basic Scroll",
  "description": "A basic scroll stolen from a traveler, contains simple knowledge.",
  "type": "material",
  "rarity": "common",
  "stackable": true,
  "maxStack": 999,
  "value": 12,
  "nameKey": "item.stolen_scroll_basic.name",
  "descriptionKey": "item.stolen_scroll_basic.description"
}
