{
  "id": "iron_dagger",
  "name": "Iron Dagger",
  "description": "A reliable iron dagger.",
  "type": "weapon",
  "rarity": "uncommon",
  "stackable": false,
  "value": 140,
  "requirements": {
    "level": 16,
    "class": [
      "rogue"
    ]
  },
  "equipmentSlot": "weapon",
  "statBonuses": {
    "dexterity": 4,
    "luck": 1
  },
  "combatStatBonuses": {
    "attack": 9,
    "speed": 7,
    "criticalChance": 3
  },
  "nameKey": "item.iron_dagger.name",
  "descriptionKey": "item.iron_dagger.description"
}
