{
  "id": "mana_potion_epic",
  "name": "Epic Mana Potion",
  "description": "Restores 500 mana.",
  "type": "consumable",
  "rarity": "epic",
  "stackable": true,
  "maxStack": 99,
  "value": 350,
  "consumableEffect": {
    "type": "mana",
    "amount": 500
  },
  "nameKey": "item.mana_potion_epic.name",
  "descriptionKey": "item.mana_potion_epic.description"
}
